Job_name,job_description,Posting_date,Experience,location,company_name,job_application_link,Type
L1 Cyber Security Analyst,"SOC - Cyber Security Analyst L1
 
 
The primary responsibilities of the Level 1 Cyber Security Analyst are to sort, filter, analyze, qualify and escalate various cyber-security alerts inside log aggregation tools (SIEM) such as ArcSight, Splunk, and QRadar. The Analyst is also responsible for incident fo",N/A,N/A,Makati,SecureOps,https://secureops.bamboohr.com/careers/75,N/A
Security Detection Specialist,"Position Summary: 
The position of  Security Detection Specialist provides the opportunity to work with leading-edge staff and technologies. The position involves taking responsibility for the successful detection of cybersecurity incidents, leveraging advanced security technologies. Primary responsibili",N/A,N/A,Makati,SecureOps,https://secureops.bamboohr.com/careers/79,N/A
SOC - Level 2 Cyber Security Analyst,"Position Summary
Reporting to the SOC Team Leader, the technical responsibilities of the Level 2 Cyber Security Analyst include advanced qualification of security events, in-depth investigations, incident handling, security research, as well as limited content development work. To continually support the",N/A,N/A,"Prague, Czech Republic",SecureOps,https://secureops.bamboohr.com/careers/86,N/A
